title,processed_synopsis
Bull Durham,durham bull minor leagu basebal team one asset claim groupi name anni savoy susan sarandon team season begin anni select brash new recruit ebbi calvin laloosh tim robbin christen nuke inspir religion basebal nuke also receiv guidanc veteran player crash davi kevin costner settl nuke errat pitch teach follow catcher lead
The Edge of Seventeen,everyon know grow hard life easier high school junior nadin haile steinfeld alreadi peak awkward older brother darian blake jenner start date best friend krista haley lu richardson nadin feel alon ever unexpect friendship thought teen hayden szeto give glimmer hope thing might terribl
The Muppets,walter world biggest muppet fan vacat los angel brother gari jason segel gari girlfriend mari ami adam discov greedi tex richman chris cooper plan raze muppet studio drill oil spot desper save muppet former stomp ground three friend join forc kermit reunit miss piggi fozzi rest gang hold telethon rais 10 million need save studio
Broadcast News,intellig satir american televis news high strung news produc find strang attract vapid anchorman even loath everyth personifi make matter wors best friend talent particular telegen news report secret love
Silver Linings Playbook,lose job wife spend time mental institut pat solatano bradley cooper wind live parent robert de niro jacki weaver want rebuild life reunit wife parent would happi share obsess philadelphia eagl thing get complic pat meet tiffani jennif lawrenc offer help reconnect wife someth import exchang
Lost in Translation,lone age movi star name bob harri bill murray conflict newlyw charlott scarlett johansson meet tokyo bob film japanes whiskey commerci charlott accompani husband stranger foreign land two find escap distract understand amidst bright tokyo light chanc meet quiet lull hotel bar form bond unlik heartfelt meaning
Mr. Smith Goes to Washington,idealist young jefferson smith jame stewart wind appoint unit state senat gain mentorship senat joseph pain claud rain howev pain nobl reput would indic becom involv scheme discredit smith want build boy campsit lucrat project could go determin stand pain corrupt peer smith take case senat floor
Won't You Be My Neighbor?,filmmak morgan nevill examin life legaci fred roger belov host popular children tv show mister roger neighborhood
I Am Not Your Negro,1979 jame baldwin wrote letter literari agent describ next project rememb hous book revolutionari person account live assassin three close friend medgar ever malcolm x martin luther king time baldwin death 1987 left behind 30 complet page manuscript filmmak raoul peck envis book jame baldwin never finish
Apollo 11,footag audio record take straight heart nasa celebr mission astronaut neil armstrong buzz aldrin michael collin embark histor trip moon
Life Itself,filmmak steve jame chronicl life film critic roger ebert especi career highlight battl alcohol sometim ruthless rivalri fellow critic gene siskel
Man on Wire,use actual footag event seamless mingl new filmmak jame marsh master recreat daredevil philipp petit 1974 stunt perform acrobat thin wire strung twin tower world trade center plot feat like master cat burglar petit enlist help motley group friend calcul everi detail acquir build access string wire manag pull astound crime
Amazing Grace,singer aretha franklin perform gospel song new templ missionari baptist church los angel 1972
Minding the Gap,three young men bond togeth escap volatil famili rust belt hometown face adult respons unexpect revel threaten friendship
Three Identical Strangers,ident triplet becom separ birth adopt three differ famili year later amaz reunion becom global sensat also unearth unimagin secret radic repercuss
McQueen,archiv footag interview friend famili offer insight extraordinari life career british fashion design alexand mcqueen
Crip Camp,groundbreak summer camp galvan teen disabl
20 Feet From Stardom,filmmak morgan nevill shine spotlight contribut longtim backup singer like darlen love merri clayton
Weiner,former anthoni weiner run mayor new york 2013 new sex scandal ruin attempt polit comeback
Collective,direct alexand nanau toto sister collect follow heroic team journalist uncov shock widespread corrupt dead nightclub fire mysteri death owner power pharmaceut firm quiet resign health unrel event within week team intrepid report expos much larger much explos polit scandal collect detect stori truth account valu independ press partisan time
Dick Johnson Is Dead,filmmak elder father stage death various way help face inevit demis
Free Solo,alex honnold complet first free solo climb fame el capitan vertic rock face yosemit nation park
The Last Waltz,seventeen year join forc back band rockabilli cult hero ronni hawkin canadian root rocker band call quit lavish farewel show san francisco winterland ballroom 25 film martin scorses documentari featur standout perform rock legend bob dylan van morrison eric clapton joni mitchel muddi water well interview trace group histori discuss road life
Kedi,hundr thousand cat roam metropoli istanbul freeli thousand year wander peopl live impact way anim live world wild tame cat kitten bring joy purpos choos give peopl opportun reflect life place istanbul cat mirror
Totally Under Control,public health offici discuss govern respons pandem
Stop Making Sense,director jonathan demm captur frantic energi artsi groov talk head concert movi shot hollywood pantag theatr band frontman david byrn first appear empti stage arm acoust guitar gradual join bassist tina weymouth drummer chris frantz keyboardist jerri harrison cadr backup singer perform band hit culmin icon perform featur byrn enorm suit
Knock Down the House,young bartend bronx coal miner daughter west virginia griev mother nevada regist nurs missouri build movement insurg candid challeng power incumb congress one race becom shock polit upset recent american histori
Blackfish,stori tilikum captiv killer whale taken live sever peopl underscor problem within industri man relationship natur littl learn high intellig mammal
Taxi to the Dark Side,documentari explor american militari use tortur focus unsolv murder afhgani taxi driver 2002 taken question bagram forc air base five day later man dead medic examin claim driver die excess physic abus take case point film examin wider claim tortur occur base like abu ghraib guantanamo bay bush administr
Time,entrepreneur fox rich spend last two decad campaign releas husband rob rich serv prison sentenc robberi commit earli 1990s moment desper
Maiden,1989 traci edward lead first crew whitbread round world race gruel yacht competit cover mile last nine month
Murderball,documentari introduc quad rugbi team team compos entir young parapleg men use special wheelchair littl protect player play competit rugbi use rule slight alter accommod limit film follow team discuss sport live end chair begin play way 2004 paralymp game athen greec
Jodorowsky's Dune,filmmak alejandro jodorowski discuss would adapt frank herbert classic novel dune big screen
Welcome to Chechnya,activist risk live confront russian leader ramzan kadyrov campaign detain tortur execut lgbtq chechen
Shirkers,1992 teenag sandi tan shoot singapor first road movi enigmat american mentor georg abscond footag 16 mm film recov 20 year later send tan novelist live los angel person odyssey search georg footprint
Anvil! The Story of Anvil,canadian band anvil deliv high influenti 1982 album would inspir like anthrax metallica drop map begin would becom decad toil obscur director former roadi sacha gervasi follow guitarist steve lip kudlow drummer robb reiner stumbl harrow european tour reflect failur friendship resili follow even imposs dream
Inside Job,global financi meltdown took place fall 2008 caus million job home loss plung unit state deep econom recess matt damon narrat documentari provid detail examin element led collaps identifi key financi polit player director charl ferguson conduct wide rang interview trace stori unit state china iceland sever global financi hot spot
All In: The Fight for Democracy,filmmak liz garbus lisa cort examin histori voter suppress activist fight right citizen
The Square,egyptian revolutionari battl leader regim build new societi
Seymour: An Introduction,pianist seymour bernstein gave perform teach discuss passion music philosophi life
The Missing Picture,filmmak rithi panh atroc cambodia khmer roug 1975 1979
Mucho Mucho Amor: The Legend of Walter Mercado,puerto rican astrolog psychic walter mercado discuss life career seclus
Deliver Us From Evil,filmmak ami berg document case convict pedophil oliv gradi priest northern california molest children parishion appar knowledg superior dioces berg track ireland live free church protect allow give account crime
Paris Is Burning,documentari focus drag queen live new york citi hous cultur provid sens communiti support flamboy often social shun perform group hous compet elabor ball take cue world fashion also touch issu racism poverti film featur interview number renown drag queen includ willi ninja pepper labeija dorian corey
Athlete A,report indianapoli star expos larri nassar sexual abus young gymnast
One Child Nation,becom mother filmmak uncov untold histori china polici generat parent children forev shape social experi
Bright Lights: Starring Carrie Fisher and Debbie Reynolds,portrait hollywood royalti carri fisher mother debbi reynold
Hoop Dreams,everi school day teenag william gate arthur age travel 90 minut way chicago joseph high school westchest illinoi predomin white suburban school excel basketbal program gate age dream nba stardom support famili battl social physic obstacl stand way acclaim documentari shot cours five year
Citizenfour,laura poitra receiv encrypt email someon inform govern massiv program report glenn greenwald flew hong kong meet sender turn edward snowden
On the Record,filmmak kirbi dick ami zier examin sexual assault alleg mogul russel simmon
The Interrupters,member activist group ceasefir work curb violenc chicago neighborhood interven street fight show youth better way resolv conflict
Slay the Dragon,activist work rid gerrymand america elect process
Strong Island,filmmak yanc ford investig 1992 murder young black man becom ach person journey sinc victim william ford filmmak brother
Iris,filmmak albert maysl pay tribut nonagenarian iri apfel longtim interior design outspoken champion eclect fashion
Capturing the Friedmans,prepar documentari children birthday parti entertain filmmak andrew jarecki learn one subject profession clown david friedman son brother two men convict child sexual abus 1980s crimin trial use home video made friedman famili trial well new interview jarecki explor conflict stori accus alleg victim investig
The Fight,defin moment american histori scrappi team heroic aclu lawyer battl abort right immigr right lgbtq right vote right
"Mr. Death: The Rise and Fall of Fred A. Leuchter, Jr.",documentari filmmak errol morri investig case man becam author capit punish discredit got involv wrong side court case leutcher meek man whose appear beli grim expertis develop say effect electr chair long demand offici want opinion kind execut call aid case accus holocaust denier leutcher problem begin
Rewind,dig father home video young man reconstruct stori boyhood recal abus suffer
Nothing Like a Dame,spend delight bawdi afternoon four legend british stage cinema maggi smith judi dench eileen atkin joan plowright spill tea life love art
A Secret Love,former basebal player keep lesbian relationship secret famili seven decad
The Invisible War,filmmak explor incid violent sexual assault within militari
Sound City,artist produc highlight histori record studio van nuy discuss impact music age technolog
56 Up,continu project began 1964 filmmak michael apt revisit origin subject see live progress 56 year old
Elaine Stritch: Shoot Me,plagu medic issu memori laps broadway icon contempl retir mortal approach 87th birthday rehears new show
My Journey Through French Cinema,filmmak bertrand taverni examin great director actor writer compos cinematograph french cinema includ jean renoir godard melvill edmond grévill guy gill
The Act of Killing,filmmak expos horrifi mass execut accus communist indonesia celebr countri perpetr crime
More Than Honey,beekeep scientist other discuss world declin bee popul may mean modern societi
Everyday Sunshine: The Story of Fishbone,blister combin punk funk fishbon demolish wall genr challeng racial stereotyp polit order music industri nation
Bill Cunningham New York,bill cunningham one mainstay new york time contributor renown newspap mani decad also incur eccentr chronicl fashion tireless snap photo write interest attir celebr ordinari new yorker spot street exhaust profil cunningham work includ interview friend often subject tom wolf david rockefel vogu magazin anna wintour
Spellbound,eight youth competitor sponsor hometown newspap travel famili washington compet 1999 scripp nation spell bee nation spotlight heavi pressur perform parent teacher audienc children struggl advanc toward championship accompani scholarship cash prize approach competit spell focus intens olymp athlet
We Were Here,1970s san francisco becam safe gay lesbian communiti provid place one could live open away discrimin almost decad celebr citi hit wave shock grief becam ground zero aid epidem hundr gay men fall victim diseas director david weissman explor incred stori love loss eye five men women experienc firsthand
Enron: The Smartest Guys in the Room,documentari explor fall enron corpor arguabl shock exampl modern corpor corrupt compani link sever illeg scheme includ instig california energi crisi way drive util price expens averag american environ enron trader resort kind underhand deal order make money cost keep job
Sholem Aleichem: Laughing in the Darkness,filmmak joseph dorman present life work legaci yiddish writer use vernacular common man
Ai Weiwei: Never Sorry,alison klayman document life work chines artist activist ai weiwei showcas artist process prepar museum exhibit relationship famili member clash govern
13TH,filmmak ava duvernay explor histori racial inequ unit state focus fact nation prison disproportion fill
Rivers and Tides: Andy Goldsworthy With Time,andi goldsworthi art suppos fall apart creat outdoor sculptur artwork natur materi like mud wood ice stone attempt imbu physic world spiritu ephemer element director thoma riedelsheim follow goldsworthi construct art everywher upstat new york home villag scotland question solitari artist inspir frustrat artist goal
How to Survive a Plague,late 1980s member aid activist battl indiffer hostil bring attent diseas play huge role reduc number fatal
This Is Not a Film,iranian filmmak jafar panahi make video diari phone respons govern threat
When We Were Kings,octob 30 1974 perhap famous heavyweight championship box match time took place kinshasa zair rumbl jungl champion georg foreman challeng muhammad ali histor footag new interview documentari explor relationship african contin black power era term popular cultur intern polit includ brutal mobutu sese seko
RBG,intim portrait unlik rock star justic ruth bader ginsburg unpreced access filmmak explor earli legal battl chang world women
The Painter and the Thief,czech artist barbora kysilkova develop unlik friendship man stole two paint
March of the Penguins,end antarct summer emperor penguin south pole journey tradit breed ground fascin mate ritual captur documentari intrepid filmmak luc jacquet journey across frozen tundra prove simplest part ritual egg hatch femal must delic transfer male make way back distant sea nourish bring back food newborn chick
Hitchcock/Truffaut,filmmak martin scorses david fincher wes anderson other discuss legaci alfr hitchcock book hitchcock françoi truffaut
Kurt Cobain: Montage of Heck,filmmak brett morgen use materi cobain person archiv examin nirvana frontman childhood music career untim death
Cave of Forgotten Dreams,documentari filmmak werner herzog small crew given rare chanc film insid franc chauvet cave wall cover world oldest surviv paint preserv art peopl allow enter site two week year examin draw herzog discuss artwork repres human earliest dream scientist art scholar conduct research chauvet
The King of Kong: A Fistful of Quarters,name video game player centuri 1999 billi mitchel set record score donkey kong mani felt would never broken 2003 steve wieb recent lost job learn record set beat men embark battl inclus 2007 guin book world record suprem king electron game
Bowling for Columbine,polit documentari filmmak michael moor explor circumst lead 1999 columbin high school massacr broad prolifer gun high homicid rate america trademark provoc fashion moor accost kmart corpor employe plead stop sell bullet investig canada excess rate gun violenc question actor charlton heston support nation rifl associ
The Fog of War,former corpor whiz kid robert mcnamara controversi secretari defens kennedi johnson administr height vietnam war academi documentari augment archiv footag give conflict mcnamara platform attempt confront govern action southeast asia light horror modern warfar end ideolog punit judgment histori
Muscle Shoals,filmmak greg camali pay tribut alabama citi hold promin place music histori artist record fame studio muscl shoal includ perci sledg aretha franklin lynyrd skynyrd
Circus of Books,1976 coupl take adult book store store becom biggest distributor gay porn unit state
Boys State,texa teen learn american democraci organ polit parti run mock govern
Homecoming: A Film by Beyoncé,
The War Tapes,filmmak deborah scranton provid three soldier camera document experi oper iraqi freedom soldier sgt steve pink sgt zack bazzi spc mike moriarti differ age come differ background three demonstr unwav loyalti voic concern america reason presenc iraq
Searching for Sugar Man,though fade obscur earli musician known rodriguez becam huge hit south africa wide rumor die two obsess fan set learn man true fate
Jafar Panahi's Taxi,
Disclosure,look hollywood depict transgend peopl impact american cultur
Knives Out,circumst surround death crime novelist harlan thrombey mysteri one thing renown detect benoit blanc know sure everyon wild dysfunct thrombey famili suspect blanc must sift web lie red herring uncov truth
The Irishman,1950s truck driver frank sheeran get involv russel bufalino pennsylvania crime famili sheeran climb rank becom top hit man also goe work jimmi hoffa power teamster tie organ crime
The Godfather,wide regard one greatest film time mob drama base mario puzo novel name focus power crime famili vito corleon marlon brando youngest son michael al pacino reluct join mafia becom involv inevit cycl violenc betray although michael tri maintain normal relationship wife kay dian keaton drawn deeper famili busi
Moonlight,look three defin chapter life chiron young black man grow miami epic journey manhood guid kind support love communiti help rais
A Star Is Born,season musician jackson main discov fall love struggl artist alli given dream make big singer jackson coax spotlight even alli career take person side relationship break jackson fight ongo battl intern demon
A Quiet Place,hear hunt famili must live silenc avoid mysteri creatur hunt sound know even slightest whisper footstep bring death evelyn lee determin find way protect children desper search way fight back
Roma,cleo one two domest worker help antonio sofía take care four children 1970s mexico citi complic soon aris antonio sudden run away mistress cleo find pregnant sofía decid take kid vacat invit cleo getaway clear mind bond famili
Portrait of a Lady on Fire,1770 young daughter french countess develop mutual attract femal artist commiss paint wed portrait
Selma,although civil right act 1964 legal desegreg south discrimin still rampant certain area make difficult black regist vote 1965 alabama citi becam battleground fight suffrag despit violent opposit martin luther king david oyelowo follow press forward epic march selma montgomeri effort culmin presid lyndon johnson sign vote right act 1965
Spotlight,2001 editor marti baron boston globe assign team journalist investig alleg john geoghan unfrock priest accus molest 80 boy led editor walter robbi robinson michael keaton report michael rezend mark ruffalo matt carrol sacha pfeiffer interview victim tri unseal sensit document report make mission provid proof sexual abus within roman cathol church
The Shape of Water,elisa mute isol woman work clean ladi hidden govern laboratori 1962 baltimor life chang forev discov lab classifi secret mysteri scale creatur south america live water tank elisa develop uniqu bond new friend soon learn fate surviv lie hand hostil govern agent marin biologist
Arrival,linguist professor louis bank ami adam lead elit team investig gigant spaceship touch 12 locat around world nation teeter verg global war bank crew must race time find way communic extraterrestri visitor hope unravel mysteri take chanc could threaten life quit possibl mankind
The Favourite,earli 18th centuri england war french nevertheless duck race pineappl eat thrive frail queen ann occupi throne close friend ladi sarah govern countri stead tend ann ill health mercuri temper new servant abigail arriv charm endear sarah sarah take abigail wing abigail see chanc return aristocrat root
Double Indemnity,classic film noir insur salesman walter neff fred macmurray get rope murder scheme fall sensual phylli dietrichson barbara stanwyck intent kill husband tom power live fraudul accident death claim prompt late dietrichson daughter lola jean heather insur investig barton key edward robinson look case gradual begin uncov sinist truth
Marriage Story,stage director actor wife struggl gruel divorc push limit
Boyhood,joy pitfal grow seen eye child name mason ellar coltran parent patricia arquett ethan hawk sister lorelei linklat vignett film cast cours 12 year captur famili meal road trip birthday parti graduat import mileston song coldplay arcad fire artist captur time period direct richard linklat
12 Years a Slave,year civil war solomon northup chiwetel ejiofor free black man upstat new york kidnap sold slaveri south subject cruelti one malevol owner michael fassbend also find unexpect kind anoth struggl continu surviv maintain digniti 12th year dishearten ordeal chanc meet abolitionist canada chang solomon life forev
Argo,4 1979 milit storm embassi tehran iran take 66 american hostag amid chao six american manag slip away find refug canadian ambassador know matter time refuge found like execut govern call extractor toni mendez ben affleck rescu mendez plan pose hollywood produc scout locat iran train refuge act film crew
Manchester by the Sea,death older brother joe lee chandler casey affleck shock joe made sole guardian teenag nephew patrick take leav job janitor boston lee reluct return fish villag famili live generat forc deal past separ wife randi michell william communiti born rais
Leave No Trace,father daughter live perfect mysteri exist forest park beauti natur reserv near portland rare make contact world small mistak tip author sent increas errat journey search place call
Alien,deep space crew commerci starship nostromo awaken capsul halfway journey home investig distress call alien vessel terror begin crew encount nest egg insid alien ship organ insid egg leap attach one crew caus fall coma
Call Me by Your Name,summer 1983 precoci elio perlman spend day famili villa lombardi itali soon meet oliv handsom doctor student work intern elio father amid splendor surround elio oliv discov headi beauti awaken desir cours summer alter live forev
1917,world war two british soldier lanc cpl schofield lanc cpl blake receiv seem imposs order race time must cross enemi territori deliv messag could potenti save fellow comrad includ blake brother
Gravity,ryan stone sandra bullock medic engin first shuttl mission command veteran astronaut matt kowalski georg clooney helm last flight retir routin space walk pair disast strike shuttl destroy leav ryan matt strand deep space link earth hope rescu fear turn panic realiz way home may ventur space
The Maltese Falcon,noir classic detect sam spade humphrey bogart get bargain take case brought beauti secret woman mari astor soon miss wonder show troubl follow sam partner murder sam accost man peter lorr demand locat valuabl statuett sam entangl danger web crime intrigu soon realiz must find one thing seem want bejewel maltes falcon
The Florida Project,set shadow magic place earth moone two best friend forg adventur moone struggl mom kindheart motel manag protect kid harsh realiti surround
Widows,polic shootout leav four thiev dead explos arm robberi attempt chicago widow veronica linda alic bell noth common except debt left behind spous crimin activ hope forg futur term veronica join forc three women pull heist husband plan
"The Godfather, Part II",compel sequel godfath contrast life corleon father son trace problem michael corleon al pacino 1958 young immigr vito corleon robert de niro 1917 hell kitchen michael surviv mani misfortun vito introduc life crime
Never Rarely Sometimes Always,face unintend pregnanc lack local support autumn cousin skylar travel across state line new york citi fraught journey friendship braveri compass
Pain and Glory,age spanish film director middl creativ crisi revisit memor event past
Hell or High Water,tobi divorc father tri make better life son brother tanner short temper loos trigger finger togeth plan seri heist bank foreclos famili ranch stand way marcus texa ranger week away retir sibl plot final robberi must also prepar showdown crafti lawman readi ride sunset
