title,processed_synopsis
Say Anything...,charm critic acclaim tale first love lloyd john cusack etern optimist seek captur heart dian ion skye unattain beauti student surpris everyon return sentiment dian over possess divorc father john mahoney approv take power love conquer
The Lunchbox,lone housewif ila nimrat kaur decid tri ad spice stale marriag prepar special lunch neglect husband unfortun deliveri goe astray wind hand saajan irrfan khan irrit widow curious husband lack respons ila add note next day lunchbox thus begin unusu friendship saajan ila talk joy sorrow without ever meet person
Sense and Sensibility,elinor dashwood emma thompson father die famili financ crippl dashwood move cottag devonshir elinor sister mariann kate winslet torn handsom john willoughbi greg wise older colonel brandon alan rickman meanwhil elinor romant hope edward ferrar hugh grant hinder due prior engag elinor mariann strive love circumst live constant chang
The Half of It,shi introvert student help school jock woo girl secret want
From Here to Eternity,armi barrack hawaii day preced attack pearl harbor soldier box champion prew prewitt montgomeri clift refus box prefer play bugl instead capt holm philip ober subject prew gruel seri punish unknown holm gruff fair sgt warden burt lancast engag clandestin affair captain mistreat wife deborah kerr
Foreign Correspondent,crime report john jone joel mccrea turn noth dull copi editor unhappi work hope chang sceneri thing jone need get back track europ foreign correspond jone much element stumbl spi ring feel unravel truth alon seek help beauti politician daughter larain day urban english journalist georg sander
Four Weddings and a Funeral,lovabl englishman charl hugh grant group friend seem unlucki love charl meet beauti american name carri andi macdowel wed think luck may chang one magic night carri return state end might charl carri path continu cross hand nuptial one funer come believ meant togeth even time alway seem
Shakespeare in Love,shakespear love romant comedi 1990s set 1590s imagin unfold witti sexi timeless tale behind creation greatest love stori ever told young shakespear joseph fienn cash idea meet ideal woman inspir write one famous play
Midnight in Paris,gil pender owen wilson screenwrit aspir novelist vacat pari fiance rachel mcadam taken tour citi alon one excurs gil encount group strang yet familiar revel sweep along appar back time night jazz age icon art literatur time gil spend cultur hero past dissatisfi becom present
Manhattan,director woodi allen love letter new york citi star allen frustrat televis writer isaac davi malcont face middl age alon wife jill meryl streep leav woman isaac date traci mariel hemingway high school girl know wrong begin wonder braini writer mari dian keaton mistress best friend yale michael murphi might make better coupl
Gilda,johnni farrel glenn ford american gambler newli arriv bueno air argentina caught cheat game blackjack farrel manag talk way job casino owner power ballin mundson georg macreadi two form uneasi partnership base mutual lack scrupl mundson introduc farrel beauti new wife gilda rita hayworth happen farrel
Masculine-Feminine,paul léaud young idealist tri figur want life take job interview peopl market research firm move aspir pop singer madelein chantal goya affair often involv two sexi roommat paul howev disillus grow commerci societi madelein want success stori told seri 15 unrel vignett
Up in the Air,idea young new anna kendrick would put end constant travel corpor downsize ryan bingham georg clooney take tour demonstr import meet must fire mentor colleagu arrang hookup anoth vera farmiga develop feel woman prompt see other new light
Gloria Bell,divorce spend night danc floor joy let loos club around los angel soon find thrust unexpect new romanc fill joy bud love complic date
Dave,shifti white hous chief staff bob alexand frank langella hatch scheme use doubl presid kevin kline public photo opportun small busi owner dave kovic kline fit bill presid suffer debilit stroke opportunist alexand arrang dave step full time without even inform first ladi sigourney weaver take long press nation presid wife realiz someth differ
Eternal Sunshine of the Spotless Mind,pain breakup clementin kate winslet undergo procedur eras memori former boyfriend joel jim carrey mind joel discov clementin go extrem forget relationship undergo procedur slowli begin forget woman love direct former music video director michel gondri visual arrest film explor intricaci relationship pain loss
The Town,doug macray ben affleck lead band ruthless bank robber real attach except jame jeremi renner despit danger temper like brother everyth chang doug jame briefli take hostag bank employe clair keesey learn live gang neighborhood doug seek discov know fall love romanc deepen want crimin life could threaten clair
A Summer's Tale,begin new job gaspard melvil poupaud goe beach town relax week wait lena aurelia nolin girl casual date time arriv strike friendship waitress margot amanda langlet gaspard also meet solen gwenaëll simon free spirit open physic relationship agre faith gaspard spend time find feel even conflict
Moonstruck,sooner widow loretta cher accept marriag propos doltish boyfriend johnni danni aiello find fall younger brother ronni nicola cage tri resist ronni lost hand accid blame brother scrupl aggress pursu johnni countri loretta fall deeper love come learn one famili secret romanc
Before Sunset,sequel sunris film start nine year later jess ethan hawk travel across europ give read book wrote night spent vienna celin juli delpi read pari celin find spend part day togeth jess leav flight relationship jess son strong feel start return confess long
Big Night,chef primo toni shalhoub businessman secondo stanley tucci immigr brother itali open dream restaur paradis new jersey howev primo authent food unfamiliar local tast restaur struggl famous bandlead loui prima schedul appear paradis two brother put effort import meal like decid fate restaur
Howards End,helen schlegel fall paul wilcox rebuf sister margaret becom friend mother promis famili hous howard end unfortun death disappear appear inherit disappear widow henri wilcox becom attract margaret
Shithouse,lone colleg freshman forg strong connect resid assist fratern parti
Giant,wealthi texa rancher bick benedict rock hudson shake thing home return trip east coast love interest refin lesli lynnton elizabeth taylor bick lesli get marri clash sister luz merced mccambridg win admir ambiti young jett rink jame dean bick jett form tens rivalri continu surfac year pass fortun chang sweep drama
The Crying Game,irish republican armi member fergus stephen rea form unexpect bond jodi forest whitak kidnap british soldier custodi despit warn fellow ira member jude miranda richardson maguir adrian dunbar jodi make fergus promis visit girlfriend dil jay davidson london fergus flee citi seek hound former ira colleagu find increas drawn enigmat surpris dil
Daughters of the Dust,dawn 20th centuri famili gullah communiti coastal south carolina former west african slave adopt mani ancestor yoruba tradit suffer generat split young haagar kayce moor want move mainland away matriarch nana cora lee day former prostitut yellow mari get cold shoulder return island femal lover especi sister viola cheryl lynn bruce
The Quiet Man,accident kill oppon ring boxer sean thornton john wayn leav america return nativ ireland hope buy famili homestead live peac run afoul danah victor mclaglen long covet properti spite object fieri sister mari kate maureen begin romanc sean refus hand dowri mari kate refus consumm marriag sean retriev money
About a Boy,star hugh grant rich irrespons london thirti search avail women invent imaginari son start attend singl parent meet result one liaison meet marcus odd boy problem school gradual marcus becom friend teach marcus cool kid marcus help final grow
To All the Boys I've Loved Before,teenag girl love letter expos wreak havoc life
Monsoon Wedding,exuber ensembl comedi unit punjabi famili wed famili member relat world descend delhi wed ceremoni univers theme film explor bond unit famili touch dramat comed way
Revanche,desper attempt improv life prostitut girlfriend tamara irina potapenko alex johann krisch return life crime rob bank escap scene alex take refug nearbi farm belong grandfath hann thanheis struggl blend local befriend new neighbor susann ursula strauss alex startl discov husband robert andrea lust polic offic
The Martian,astronaut blast planet mar leav behind mark watney matt damon presum dead fierc storm meager amount suppli strand visitor must util wit spirit find way surviv hostil planet meanwhil back earth member nasa team intern scientist work tireless bring home crew mate hatch plan dare rescu mission
Edge of Tomorrow,earth fall attack invinc alien militari unit world abl beat william cage tom cruis offic never seen combat assign suicid mission kill within moment cage find thrown time loop reliv brutal fight death howev cage fight skill improv encor bring comrad emili blunt ever closer defeat alien
Snowpiercer,ice age forc human last survivor aboard supertrain one man chris evan risk everyth lead revolt control engin futur world
Blade Runner,deckard harrison ford forc polic boss emmet walsh continu old job replic hunter assign elimin four escap replic coloni return earth start job deckard goe tyrel corpor meet rachel sean young replic girl fall love
The Hunger Games: Catching Fire,arriv safe home unpreced victori 74th annual hunger game katniss everdeen jennif lawrenc peeta mellark josh hutcherson discov must quick turnaround begin victor tour peeta travel throughout district katniss sens rebellion stir howev presid snow donald sutherland prove still much control word come cruel chang rule upcom 75th hunger game
Love Is Strange,recent marri gay coupl john lithgow alfr molina forc move separ household lose home
Last Year at Marienbad,unconvent french drama group unnam aristocrat interact palati château result enigmat tale told partial flashback x giorgio albertazzi convinc met beauti delphin seyrig czech resort town marienbad impli romant relationship sacha pitoeff may husband boyfriend confront mysteri suitor lead conflict question truth behind stori
Undefeated,sinc found 1899 manassa high school north memphi never footbal team win playoff game 2004 former coach bill courtney offer help turn manassa tiger around nurtur player physic emot strength courtney effort pay 2009 tiger led star player seem chanc break school lose streak final win playoff game
The Overnighters,pastor spark controversi north dakota town open church door homeless worker seek job nearbi oil field
Call Me Kuchu,uganda open gay david kato fellow activist work defeat new legisl countri would make homosexu punish death
Holy Motors,driven around pari loyal driver édith scob mysteri man deni lavant dress costum play number strang semiscript role
Restrepo,photograph tim hetherington journalist sebastian junger allow realiti war speak unnarr documentari platoon afghanistan men second platoon battl compani 173rd airborn brigad teeter naivet weari month altern boredom fight take toll loss medic juan doc restrepo lead platoon name outpost remot koreng valley
Mea Maxima Culpa: Silence in the House of God,filmmak alex gibney examin report pedophilia within roman cathol church focus specif group men alleg abus boy priest milwauke school deaf
Let the Fire Burn,filmmak jason osder illustr prejudic intoler fear lead unthink act violenc
The Queen of Versailles,2008 global econom crisi threaten fortun florida billionair david jacki siegel middl build estat
For the Bible Tells Me So,delv valu religi right accompani homophobia bibl tell focus conserv christian interpret bibl common use way deni homosexu equal right follow five famili open gay son daughter director daniel karslak offer firsthand look christian communiti child affect homophob fervor karslak also interview number religi leader
Blindsight,six blind tibetan teenag shun cultur sinner possess demon band togeth climb north side mount everest inspir fieri blind teacher fought establish tibetan school blind children teen guid erik weihenmay blind mountain success scale everest climber suffer ill bad weather stark challeng tackl one greatest natur wonder planet
Pandora's Box,acclaim german silent film lulu louis brook young woman beauti allur resist siren charm men drawn web includ respect newspap publish ludwig schön fritz kortner music produc son alwa franz leder circus perform rodrigo quast lulu seedi old friend schigolch carl goetz lulu charm inevit lead tragedi downward spiral encompass
The Imposter,filmmak bart layton chronicl tale freder bourdin con artist seem trick texa famili believ relat disappear year earlier
Surfwise,forsak tradit home life dorian doc paskowitz wife rais larg brood camper spend time surf
No End in Sight,documentari film take critic look american invas iraq 2003 war follow film includ extens interview various militari govern offici mani work presid georg bush begin iraq war filmmak charl ferguson use account suggest bush administr well provision govern instat iraq made crucial irrespons error
The Life and Times of Hank Greenberg,life time hank greenberg humor nostalg documentari extraordinari basebal player transcend religi prejudic becom american icon detroit tiger hammerin hank accomplish golden age basebal rival babe ruth lou gehrig
Burma VJ: Reporting From a Closed Country,thousand citizen myanmar take street sever citi protest asian nation repress regim protest take new degre serious dozen monk launch march citi street documentari ander ostergaard focus work videograph citizen journalist defi govern crackdown media brave bunch manag transmit footag upris outsid world
An Inconvenient Truth,filmmak davi guggenheim follow al gore lectur circuit former presidenti candid campaign rais public awar danger global warm call immedi action curb destruct effect environ
Finding Vivian Maier,life work career nanni vivian maier amaz collect photograph
Winged Migration,documentari present epic portrait winter bird migrat film seven contin four year footag brought togeth one portrait journey uniform arduous kind differ bird rather concentr statist fact film portray sheer physic effort demand bird dispar rout along way see mani danger face wast group hungri crab
Sicko,filmmak michael moor examin america crisi million citizen without coverag moor spotlight case sever ordinari citizen whose live shatter bureaucrat red tape refus payment catastroph explain system becom problemat visit countri citizen receiv free health care canada franc
Sweetgrass,spare documentari follow group shepherd guid hundr sheep endless mile montana wilder herd livestock beartooth mountain crew cover stun landscap brave danger weather threat various wild anim includ bear wolv shepherd make journey film depict hardship face occup seem larg outmod unit state
A Film Unfinished,isra director yael hersonski examin recent found film reel unfinish nazi movi entitl das ghetto documentari decad historian reli das ghetto portray life occupi warsaw new footag provid rare insight one biggest propaganda machin time hersonski use person journal account well interview surviv cameraman dark cinemat relic
"Bigger, Stronger, Faster",documentari present pervas use steroid sport indic american obsess win cost bell brother suck world drug think ticket realiz american dream interview politician doctor bodybuild coach rais question end realli justifi mean mad dash win entir cultur may pois lose
Trouble the Water,hurrican katrina rage around scott kimber river robert took shelter neighbor attic new orlean ninth ward kimber aspir rapper brought video camera film husband friend devast storm footag heart tia lessin carl deal documentari hurrican katrina tragedi along filmmak footag kimber scott rebuild live afterward
"Food, Inc.",documentari filmmak robert kenner examin mammoth corpor taken aspect food chain unit state farm food grown chain restaur supermarket sold narrat author activist eric schlosser film featur interview averag american dietari habit commentari food expert like michael pollan unsettl footag shot insid anim process plant
Chasing Ice,jame balog team extrem ice survey assembl multiyear chronicl planet rapid melt glacier
To Be and to Have,rural franc schoolteach georg lopez educ 12 children whose age rang 4 11 year old cours year lopez instruct one small classroom tradit tool french teach rote repetit dictat literari passag copi season pass lopez must keep student disciplin prepar older children exam determin educ futur
The Salt of the Earth,juliano ribeiro salgado look career father photograph sebastião salgado
The Wild Parrots of Telegraph Hill,homeless musician life transform discov flock wild south american parrot live san francisco got mysteri mark bittner form bond exot bird music patient attent care time come appreci individu ident make case human reevalu relationship anim forc leav despair bird fate
The Gatekeepers,six former head israel secret servic agenc shin bet discuss organ success failur sinc six day war 1967
Control Room,filmmak jehan noujaim provid look oper promin televis news network arab world war iraq interview american journalist journalist report militari offici noujaim explor natur media bias relationship arab communiti network percept western world
Bus 174,young brazilian hijack bus rio de janeiro rob passeng hold entir bus hostag press broadcast live documentari chronicl incompet respons polic offic public event inspir nationwid protest includ detail captor harsh childhood wit mother murder homeless provid one exampl tragic social polit indiffer urban poverti modern brazil
Touching the Void,1985 two young climber joe simpson brendan mackey simon yate nichola aaron set first reach summit siula grand peruvian andes succeed two embark treacher descent mountain meet disast simpson break leg fall leav yate lower rest way rope storm threaten live yate must decid whether cut rope risk simpson like death
My Winnipeg,canadian filmmak guy maddin conduct person tour winnipeg manitoba town grew still live film call combin archiv footag interview dreamlik camera work recreat scene includ sever actress ann savag play part maddin mother filmmak build portrait winnipeg manag histor intim surreal entertain entir
Manakamana,high nepal cabl car transport visitor ancient hindu templ site shrine goddess manakamana
I Am Divine,life work cultur icon record artist actor divin
Cutie and the Boxer,noriko seek ident 40 year marriag famous box artist ushio shinohara
Brooklyn Castle,chess help transform new york school one citi best budget cut threaten undermin school championship chess team
Deep Water,1968 donald crowhurst inexperienc british sailor put home collater gain financi back enter golden globe first nonstop boat race around world dire financi pressur crowhurst decid set sail boat fulli built leav unprepar stress open ocean crowhurst decis embark vessel readi set dead chain event motion
The Last of the Unjust,benjamin murmelstein jewish elder surviv world war ii fought adolf eichmann week week seven year manag help jew leav germani
The Devil Came on Horseback,serv african union former marin capt brian steidl document brutal ethnic cleans occur darfur determin western public know atroc wit steidl contact new york time report nichola kristof publish steidl photograph evid
Good Hair,prompt question young daughter comic chris rock set explor import hair black cultur rock interview celebr raven symon visit hair salon stylist competit even indian templ learn hair cultur
Up the Yangtze,documentari examin china rapid chang economi focus construct three gorg dam govern dam stand symbol progress displac hundr famili creation follow local teenag chen bo yu yu shi work one western cruis line sail yangtz near dam film detail friction chines societi citizen struggl realiti new consum capit
5 Broken Cameras,begin 2005 palestinian emad burnet record villag resist encroach isra settlement
National Gallery,educ program scholar scientist curat work enjoy nation galleri london
Plagues and Pleasures on the Salton Sea,john water narrat stori southern california salton sea lake consid prime recreat locat turn ecolog disast
Last Days in Vietnam,final week vietnam war american servicemen other begin difficult mission evacu mani friend famili member south vietnames collabor possibl saigon fall north vietnames
Super Size Me,director morgan spurlock social experi gastronomi see attempt subsist uniqu food mcdonald menu entir month process weight balloon energi level plummet experi sort unexpect terrifi side effect also examin corpor giant grow role live american consum explor method indoctrin young peopl contribut america obes epidem
The Arbor,mix documentari fiction element tell stori doom playwright andrea dunbar wrote difficult life endur grow england bradford hous project archiv footag featur dunbar present along interview famili member includ daughter lorrain led similar troubl life excerpt dunbar famous play arbor perform street hometown buttershaw estat live
Rocky,rocki balboa sylvest stallon boxer philadelphia arbitrarili chosen take reign world heavyweight champion apollo creed carl weather undef fighter schedul oppon injur train feisti former bantamweight contend mickey goldmil burgess meredith rocki tentat begin relationship adrian talia shire wallflow sister pal pauli burt young
Battle of the Sexes,1973 tenni match billi jean king bobbi rigg becam watch televis sport event time trap media glare king rigg opposit side binari argument fight person complex battl husband urg fight equal pay privat king also struggl come term sexual rigg gambl legaci reput bid reliv glori past
The Fighter,micki ward mark wahlberg box famili affair mother manag dicki christian bale promis boxer unreli trainer despit micki hard work lose latest fight near kill follow girlfriend advic split famili micki becom contend world titl famili earn shot redempt
The Crash Reel,snowboard kevin pearc suffer traumat brain injuri train 2010 winter olymp famili stand side struggl rehab object express desir return favorit sport
Sugar,like mani young men dominican republ miguel sugar santo algeni perez soto dream win slot american basebal team inde talent pitcher eventu land slot team iowa cultur shock racism curvebal threaten turn sugar dream sour
Senna,ayrton senna becom formula one race champion brazil nation hero untim death age 34
The Damned United,stori brian clough 44 day stint manag leed unit footbal club take place 1974 england revi quit leed becom england boss outspoken brian clough take charg determin impos style upon revi tough tackl team clough soon alien player board base book david pearc
Creed II,1985 russian boxer ivan drago kill former champion apollo creed tragic match stun world wish trainer rocki balboa apollo son adoni johnson accept challeng drago son anoth danger fighter guidanc rocki adoni train showdown life date destini soon becom obsess johnson balboa must confront share legaci past come back haunt man
Boxing Gym,veteran documentari filmmak frederick wiseman turn len world box specif gym austin texa unobtrus record simpl come go facil wiseman document daili life gym mani patron routin owner richard lord film forgo techniqu common modern documentari interview reenact etc favor approach
Red Army,hockey captain slava fetisov four player form near unbeat unit known russian five coach brutal regimen lead fetisov other defect soviet union
Riding Giants,part sport histori part thrill ride skateboard staci peralta documentari pay homag brave foolish surfer dare ride world biggest wave peralta lay evolut surf today touch upon chang trend constant search ever larger wave shift focus hand contemporari surf superstar among jeff clark pioneer san francisco remot wave laird hamilton known ride
Dogtown and Z-Boys,dogtown direct skateboard staci peralta stori group accident revolutionari gift kid inadvert chang world came natur also uniqu documentari event eyewit account birth organ american pop cultur phenomenon
The Color of Money,former pool hustler fast eddi felson paul newman decid want return game take pupil meet talent green vincent lauria tom cruis propos partnership tour pool hall eddi teach vincent trick scam eventu grow frustrat vincent showboat antic lead argument eddi take play soon cross path vincent oppon
Up for Grabs,final leg major leagu basebal 2001 season giant batter barri bond score histor 73rd home run san francisco pac bell park victori ensu scuffl control ball spectat patrick hayashi notion disput nearbi alex popov claim hayashi wrestl ball director michael wranov examin result court battl media circus follow event obsess fan behind controversi
Hoosiers,fail colleg coach norman dale gene hackman get chanc redempt hire direct basketbal program high school tini indiana town teacher barbara hershey persuad star player jimmi chitwood quit focus studi dale struggl develop win team face communiti critic temper unconvent choic assist coach shooter denni hopper notori alcohol
Girlfight,newcom michell rodriguez astound perform alongsid jaim tirelli paul calderon santiago dougla noth come easi diana guzman troubl girl brink womanhood teacher understand father underestim friend diana struggl find respect digniti everi day diana quick temper young woman find disciplin love unlik place box ring
Tristram Shandy: A Cock and Bull Story,director tri shoot adapt novel consid imposs film
Heaven Can Wait,joe pendleton warren beatti quarterback los angel ram kill auto accid afterlif joe discov guardian angel buck henri taken bodi prematur due mani year earth unabl return bodi joe assum form greedi multimillionair industrialist leo farnsworth farnsworth joe attempt return footbal fall love environment activist betti logan juli christi
